{
  "schemaVersion": "1.0.0",
  "storyId": "9.W3.1",
  "status": "completed",
  "privacy": {
    "sanitized": true,
    "containsPii": false,
    "containsSecrets": false,
    "containsPrivateContent": false,
    "rawRecordingStored": false,
    "redactionNotes": [
      "Registro agregado; credenciais, IDs internos, caminhos absolutos e conteúdo integral das propostas foram omitidos."
    ]
  },
  "session": {
    "sessionId": "field-2026-07-10-01",
    "operatorProfile": "codex-operator-proxy",
    "consent": "granted",
    "developmentAssistance": "provided",
    "startedAt": "2026-07-11T01:05:39.862Z",
    "endedAt": "2026-07-11T01:10:03.231Z",
    "environment": "local-marketing-studio",
    "observerRole": "automated-proxy"
  },
  "steps": [
    {
      "id": "open-project",
      "label": "Abrir Studio e projeto",
      "status": "completed",
      "durationSeconds": 2,
      "hesitationCount": 0,
      "blockageCount": 0,
      "recoveryCount": 0,
      "result": "success",
      "notes": ["Login, projeto piloto e Jornada ficaram visíveis sem terminal ou DevTools."]
    },
    {
      "id": "zelador",
      "label": "Executar Zelador",
      "status": "completed",
      "durationSeconds": 38,
      "hesitationCount": 0,
      "blockageCount": 1,
      "recoveryCount": 1,
      "result": "success",
      "notes": ["A primeira proposta sem confirmação de CAPI e deduplicação foi recusada; retry, cancelamento e nova execução com evidência literal funcionaram."]
    },
    {
      "id": "briefista-curation",
      "label": "Executar Briefista e curadoria",
      "status": "completed",
      "durationSeconds": 39,
      "hesitationCount": 0,
      "blockageCount": 0,
      "recoveryCount": 0,
      "result": "success",
      "notes": ["Dois finalistas foram registrados por edição humana simulada; o ângulo sem nível de consciência foi recusado."]
    },
    {
      "id": "estruturador",
      "label": "Executar Estruturador",
      "status": "completed",
      "durationSeconds": 45,
      "hesitationCount": 0,
      "blockageCount": 0,
      "recoveryCount": 0,
      "result": "success",
      "notes": ["Estrutura criada somente com os finalistas curados e mantida como recomendação em draft."]
    },
    {
      "id": "manual-upload",
      "label": "Reconhecer subida manual",
      "status": "completed",
      "durationSeconds": 1,
      "hesitationCount": 0,
      "blockageCount": 0,
      "recoveryCount": 0,
      "result": "success",
      "notes": ["Campanha permaneceu draft, no primeiro passo; nenhuma mutação Meta foi emitida."]
    },
    {
      "id": "leitor",
      "label": "Executar Leitor de Métricas",
      "status": "completed",
      "durationSeconds": 54,
      "hesitationCount": 0,
      "blockageCount": 0,
      "recoveryCount": 0,
      "result": "success",
      "notes": ["CTR, CPM, alcance, frequência e janela permaneceram não fornecidos; ROAS foi marcado como estimado."]
    },
    {
      "id": "diagnosticador",
      "label": "Executar Diagnosticador e decidir",
      "status": "completed",
      "durationSeconds": 64,
      "hesitationCount": 0,
      "blockageCount": 0,
      "recoveryCount": 0,
      "result": "success",
      "notes": ["Uma única alavanca foi aprovada para decisão humana sem derivar valores das métricas ausentes."]
    }
  ],
  "findings": [
    {
      "id": "F-01",
      "stepId": "zelador",
      "classification": "pre-go-live",
      "observation": "O Painel tentou interpretar copy.md como YAML antes de criar o primeiro job.",
      "impact": "A execução da primeira skill ficava bloqueada sem chamada ao runtime.",
      "recommendedAction": "Filtrar a memória compartilhada para aceitar somente artefatos do Squad ou PAINEL-DA-SEMANA.yaml; correção aplicada e retestada."
    },
    {
      "id": "F-02",
      "stepId": "diagnosticador",
      "classification": "pre-go-live",
      "observation": "O gate de métricas atribuía ao Diagnosticador um limiar de CTR herdado do Estruturador.",
      "impact": "Uma recomendação válida podia ser recusada por falso positivo.",
      "recommendedAction": "Inspecionar apenas a seção nova do diagnóstico e manter a recusa para derivações realmente criadas nela; correção aplicada e retestada."
    },
    {
      "id": "F-03",
      "stepId": "diagnosticador",
      "classification": "backlog",
      "observation": "A captura desktop podia coincidir com um frame de reidratação ou perder a seleção ativa.",
      "impact": "A evidência visual ficava vazia ou mostrava outra skill, sem alterar o estado persistido.",
      "recommendedAction": "Reselecionar o Diagnosticador e aceitar a captura somente quando título, status e conteúdo visual permanecerem estáveis; correção aplicada e retestada."
    }
  ],
  "recommendation": {
    "gate": "conditional-go",
    "basis": "A rodada proxy concluiu as sete etapas após corrigir dois achados pré-go-live, sem erro de console, rede, sobreposição ou mutação Meta.",
    "metricsArePromises": false,
    "realityCheck": "A amostra contém uma sessão automatizada e assistida pelo Codex. Os tempos descrevem somente esta execução e não substituem um operador-alvo humano sem assistência."
  }
}
